{
  "metadata": {
    "id": "hard-copies-2026",
    "generated_at": "2026-05-08T15:30:09.850Z",
    "route": "./hard-copy.html",
    "source_page": "hard-copy.html"
  },
  "provenance": [
    {
      "file": "hard-copy.html",
      "role": "page DOM/rendering contract"
    },
    {
      "file": "processed_data/hard_data_exports/hard_copy_pdf_manifest.web.json",
      "role": "visitor PDF library manifest"
    }
  ],
  "route": {
    "id": "hard-copies",
    "label": "Hard Copies",
    "path": "./hard-copy.html",
    "source_file": "hard-copy.html",
    "title": "U.O.G.A. Hard Data",
    "seo": {
      "title": "U.O.G.A. Hard Data",
      "description": "Hard Copies page in the UOGA hunt tool site."
    },
    "ui_contract": {
      "title": "U.O.G.A. Hard Data",
      "ids": [
        "librarySearch",
        "libraryCount",
        "libraryClearFilters",
        "libraryTypeFilter",
        "libraryYearFilter",
        "libraryChips",
        "activeFilterChips",
        "librarySections"
      ],
      "data_attributes": [
        "data-group",
        "data-clear"
      ],
      "links": [
        "./assets/logos/favicon.ico.png",
        "./style.css?v=20260423-planner-header-refine-1",
        "./index.html#google-maps",
        "./research.html",
        "./verify.html",
        "./hard-copy.html",
        "${escapeHtml(item.href)}"
      ],
      "options": [
        {
          "value": "all",
          "label": "All document types"
        },
        {
          "value": "all",
          "label": "All years"
        },
        {
          "value": "${escapeHtml(type)}",
          "label": "${escapeHtml(type === 'all' ? 'All file types' : type.toUpperCase())}"
        },
        {
          "value": "${escapeHtml(year)}",
          "label": "${escapeHtml(year === 'all' ? 'All years' : year)}"
        }
      ]
    }
  },
  "manifest_url": "./processed_data/hard_data_exports/hard_copy_pdf_manifest.web.json",
  "group_labels": {
    "draw_odds": "Draw Odds / Results",
    "harvest_report": "Harvest Reports",
    "conservation_permits": "Conservation Permits",
    "regulation": "Regulations / Guidebooks"
  },
  "filters": [
    {
      "id": "librarySearch",
      "field": "title/subtitle/type/group/year",
      "type": "search"
    },
    {
      "id": "libraryTypeFilter",
      "field": "type",
      "type": "select"
    },
    {
      "id": "libraryYearFilter",
      "field": "year",
      "type": "select"
    },
    {
      "id": "libraryChips",
      "field": "group",
      "type": "tablist"
    }
  ],
  "library": {
    "items": [
      {
        "group": "harvest_report",
        "type": "pdf",
        "year": "2025",
        "title": "2025 Preliminary Big Game Harvest Report",
        "subtitle": "Official Utah DWR preliminary big-game harvest report published March 6, 2026.",
        "href": "./processed_data/hard_data_exports/source_pdfs/harvest_report/2025/2025-preliminary-big-game-harvest-report.pdf",
        "source_authority": "Utah Division of Wildlife Resources",
        "source_year": "2025",
        "model_year_folder": "2026",
        "source_role": "official_source",
        "parent_title": null
      },
      {
        "group": "regulation",
        "type": "pdf",
        "year": "2026",
        "title": "2026 Waterfowl Guidebook",
        "subtitle": "Official Utah DWR waterfowl regulation guidebook.",
        "href": "./processed_data/hard_data_exports/source_pdfs/regulations/2026/2026-waterfowl-guidebook.pdf",
        "source_authority": "Utah Division of Wildlife Resources",
        "source_year": "2026",
        "model_year_folder": "2026",
        "source_role": "official_source",
        "parent_title": null
      },
      {
        "group": "regulation",
        "type": "pdf",
        "year": "2025",
        "title": "2025-26 Upland Game Turkey Guidebook",
        "subtitle": "Official Utah DWR upland game and turkey regulation guidebook.",
        "href": "./processed_data/hard_data_exports/source_pdfs/regulations/2025-26/2025-26-upland-game-turkey-guidebook.pdf",
        "source_authority": "Utah Division of Wildlife Resources",
        "source_year": "2025",
        "model_year_folder": "2026",
        "source_role": "official_source",
        "parent_title": null
      },
      {
        "group": "regulation",
        "type": "pdf",
        "year": "2026",
        "title": "2026 Bear Cougar Furbearer Guidebook",
        "subtitle": "Official Utah DWR bear, cougar, and furbearer regulation guidebook.",
        "href": "./processed_data/hard_data_exports/source_pdfs/regulations/2026/2026-bear-cougar-furbearer-guidebook.pdf",
        "source_authority": "Utah Division of Wildlife Resources",
        "source_year": "2026",
        "model_year_folder": "2026",
        "source_role": "official_source",
        "parent_title": null
      },
      {
        "group": "regulation",
        "type": "pdf",
        "year": "2026",
        "title": "2026 Big Game Application Guidebook",
        "subtitle": "Official Utah DWR big-game application guidebook.",
        "href": "./processed_data/hard_data_exports/source_pdfs/regulations/2026/2026-big-game-application-guidebook.pdf",
        "source_authority": "Utah Division of Wildlife Resources",
        "source_year": "2026",
        "model_year_folder": "2026",
        "source_role": "official_source",
        "parent_title": null
      },
      {
        "group": "regulation",
        "type": "pdf",
        "year": "2026",
        "title": "2026 Fishing Guidebook",
        "subtitle": "Official Utah DWR fishing regulation guidebook.",
        "href": "./processed_data/hard_data_exports/source_pdfs/regulations/2026/2026-fishing-guidebook.pdf",
        "source_authority": "Utah Division of Wildlife Resources",
        "source_year": "2026",
        "model_year_folder": "2026",
        "source_role": "official_source",
        "parent_title": null
      },
      {
        "group": "regulation",
        "type": "pdf",
        "year": "2026",
        "title": "2026 Turkey Guidebook",
        "subtitle": "Official Utah DWR turkey regulation guidebook.",
        "href": "./processed_data/hard_data_exports/source_pdfs/regulations/2026/2026-turkey-guidebook.pdf",
        "source_authority": "Utah Division of Wildlife Resources",
        "source_year": "2026",
        "model_year_folder": "2026",
        "source_role": "official_source",
        "parent_title": null
      },
      {
        "group": "draw_odds",
        "type": "pdf",
        "year": "2025",
        "title": "2025 Turkey Bonus Point Purchase Results",
        "subtitle": "Official Utah DWR turkey bonus-point purchase source PDF used for the 2026 model-year data library.",
        "href": "./processed_data/hard_data_exports/source_pdfs/draw_odds/2025/2025-turkey-bonus-point-purchase-results.pdf",
        "source_authority": "Utah Division of Wildlife Resources",
        "source_year": "2025",
        "model_year_folder": "2026",
        "source_role": "official_source",
        "parent_title": null
      },
      {
        "group": "draw_odds",
        "type": "pdf",
        "year": "2025",
        "title": "2025 Youth Dedicated Hunter Draw Results",
        "subtitle": "Official Utah DWR youth Dedicated Hunter draw-results source PDF.",
        "href": "./processed_data/hard_data_exports/source_pdfs/draw_odds/2025/2025-youth-dedicated-hunter-draw-results.pdf",
        "source_authority": "Utah Division of Wildlife Resources",
        "source_year": "2025",
        "model_year_folder": "2026",
        "source_role": "official_source",
        "parent_title": null
      },
      {
        "group": "draw_odds",
        "type": "pdf",
        "year": "2025",
        "title": "2025 Youth G.S. Mature Bull Draw Results",
        "subtitle": "Official Utah DWR youth general-season mature bull elk draw-results source PDF.",
        "href": "./processed_data/hard_data_exports/source_pdfs/draw_odds/2025/2025-youth-general-season-mature-bull-draw-results.pdf",
        "source_authority": "Utah Division of Wildlife Resources",
        "source_year": "2025",
        "model_year_folder": "2026",
        "source_role": "official_source",
        "parent_title": null
      },
      {
        "group": "draw_odds",
        "type": "pdf",
        "year": "2025",
        "title": "2025 Youth G.S. Deer Draw Results",
        "subtitle": "Official Utah DWR youth general-season deer draw-results source PDF.",
        "href": "./processed_data/hard_data_exports/source_pdfs/draw_odds/2025/2025-youth-general-season-deer-draw-results.pdf",
        "source_authority": "Utah Division of Wildlife Resources",
        "source_year": "2025",
        "model_year_folder": "2026",
        "source_role": "official_source",
        "parent_title": null
      },
      {
        "group": "draw_odds",
        "type": "pdf",
        "year": "2025",
        "title": "2025 Youth Antlerless Draw Results",
        "subtitle": "Official Utah DWR youth antlerless draw-results source PDF.",
        "href": "./processed_data/hard_data_exports/source_pdfs/draw_odds/2025/2025-youth-antlerless-draw-results.pdf",
        "source_authority": "Utah Division of Wildlife Resources",
        "source_year": "2025",
        "model_year_folder": "2026",
        "source_role": "official_source",
        "parent_title": null
      },
      {
        "group": "draw_odds",
        "type": "pdf",
        "year": "2025",
        "title": "2025 Antlerless Draw Results",
        "subtitle": "Official Utah DWR antlerless draw-results source PDF.",
        "href": "./processed_data/hard_data_exports/source_pdfs/draw_odds/2025/2025-antlerless-draw-results.pdf",
        "source_authority": "Utah Division of Wildlife Resources",
        "source_year": "2025",
        "model_year_folder": "2026",
        "source_role": "official_source",
        "parent_title": null
      },
      {
        "group": "draw_odds",
        "type": "pdf",